{
  "schemaVersion": "1",
  "criteriaId": "rc-performance-resource-linux-x64-benchmarks-v1",
  "fixedAt": "2026-09-23",
  "derivation": {
    "repetitions": 5,
    "percentile": "p95",
    "margin": "2x observed p95 for timing ceilings (rounded up: whole ms below 10ms, nearest 5ms below 100ms, nearest 50ms below 1000ms, else nearest 100ms); half observed minimum for throughput floors (rounded down: nearest 10,000 bytes/s below 1,000,000, else nearest 100,000); 2.5x observed maximum for memory caps (rounded up to the nearest mebibyte)"
  },
  "baseline": {
    "summaryPath": "evidence/603/summary.json",
    "sourceCommit": "3144bb32c6ebf8f1eefa2cbbad7d431d1d6e8c4c",
    "verifiedCommit": "99c8c2b33e99142620bcc66f115200ca615d6d0a",
    "verificationPath": "evidence/528/99c8c2b-verified/acceptance.json",
    "accuracyCorpusVersion": "3",
    "accuracyCorpusHash": "ca96dddd9cb189e83db6cde203060e559f116670f823dd9631c3850aed4892d0",
    "workloadProfilesVersion": "1",
    "workloadProfilesHash": "b4db2cd22b4c008c9d63789df8ca2e21e697a21a84699466ea5f96c89d8e2806"
  },
  "minimumRepetitions": 5,
  "environment": {
    "id": "linux-x64-node22-chromium",
    "osPrefixes": [
      "linux-"
    ],
    "cpus": [
      "x86_64",
      "x64"
    ],
    "runtimePrefixes": {
      "rust-core": [
        "rustc-"
      ],
      "python": [
        "cpython-3."
      ],
      "node": [
        "node-22."
      ],
      "browser-wasm": [
        "chromium-"
      ],
      "cli": [
        "rustc "
      ]
    }
  },
  "accuracy": {
    "falseNegatives": 5,
    "falsePositives": 1,
    "policyMismatches": 0,
    "truePositives": 21
  },
  "performance": [
    {
      "surface": "browser-wasm",
      "profileId": "scale-logs-medium-fixed4096",
      "maxInitializationP95Ms": 35,
      "maxProcessingP95Ms": 250,
      "minThroughputBytesPerSecond": 1100000,
      "memoryCapsBytes": {
        "browserJsHeap": 99614720
      }
    },
    {
      "surface": "browser-wasm",
      "profileId": "scale-logs-small-whole",
      "maxInitializationP95Ms": 30,
      "maxProcessingP95Ms": 75,
      "minThroughputBytesPerSecond": 920000,
      "memoryCapsBytes": {
        "browserJsHeap": 25165824
      }
    },
    {
      "surface": "cli",
      "profileId": "scale-logs-medium-fixed4096",
      "maxInitializationP95Ms": 6,
      "maxProcessingP95Ms": 200,
      "minThroughputBytesPerSecond": 1500000,
      "memoryCapsBytes": {
        "processRss": 8388608
      }
    },
    {
      "surface": "cli",
      "profileId": "scale-logs-small-whole",
      "maxInitializationP95Ms": 6,
      "maxProcessingP95Ms": 50,
      "minThroughputBytesPerSecond": 1400000,
      "memoryCapsBytes": {
        "processRss": 8388608
      }
    },
    {
      "surface": "node",
      "profileId": "scale-logs-medium-fixed4096",
      "maxInitializationP95Ms": 15,
      "maxProcessingP95Ms": 200,
      "minThroughputBytesPerSecond": 1400000,
      "memoryCapsBytes": {
        "nodeHeap": 54525952,
        "nodeRss": 243269632,
        "nodeExternal": 6291456
      }
    },
    {
      "surface": "node",
      "profileId": "scale-logs-small-whole",
      "maxInitializationP95Ms": 15,
      "maxProcessingP95Ms": 35,
      "minThroughputBytesPerSecond": 2000000,
      "memoryCapsBytes": {
        "nodeHeap": 18874368,
        "nodeRss": 170917888,
        "nodeExternal": 6291456
      }
    },
    {
      "surface": "python",
      "profileId": "scale-logs-medium-fixed4096",
      "maxInitializationP95Ms": 3,
      "maxProcessingP95Ms": 200,
      "minThroughputBytesPerSecond": 1600000,
      "memoryCapsBytes": {
        "pythonHeap": 2097152,
        "processRss": 53477376
      }
    },
    {
      "surface": "python",
      "profileId": "scale-logs-small-whole",
      "maxInitializationP95Ms": 2,
      "maxProcessingP95Ms": 35,
      "minThroughputBytesPerSecond": 2000000,
      "memoryCapsBytes": {
        "pythonHeap": 1048576,
        "processRss": 54525952
      }
    },
    {
      "surface": "rust-core",
      "profileId": "scale-logs-medium-fixed4096",
      "maxInitializationP95Ms": 1,
      "maxProcessingP95Ms": 200,
      "minThroughputBytesPerSecond": 1600000,
      "memoryCapsBytes": {
        "processRss": 10485760
      }
    },
    {
      "surface": "rust-core",
      "profileId": "scale-logs-small-whole",
      "maxInitializationP95Ms": 1,
      "maxProcessingP95Ms": 40,
      "minThroughputBytesPerSecond": 1700000,
      "memoryCapsBytes": {
        "processRss": 10485760
      }
    }
  ]
}
